Property Name,County,DesDate,National Register Number,Longitude,Latitude,Georeference,Type
Erasmus Hall Academy,Kings,11/11/75,90NR01334,-73.9571674,40.64960698,POINT (-73.9571674011 40.6496069801),academy
Brooklyn Academy of Music,Kings,5/2/06,05NR05534,-73.97769895,40.68647104,POINT (-73.9776989529 40.6864710427),academy
St. Walburga's Academy,New York,7/28/04,03NR05194,-73.95449646,40.82424613,POINT (-73.9544964573 40.8242461278),academy
New York Cancer Hospital,New York,4/29/77,90NR00690,-73.96077238,40.79788855,POINT (-73.9607723762 40.7978885487),hospital
Triboro Hospital for Tuberculosis,Queens,1/31/19,18NR00080,-73.80754374,40.71756971,POINT (-73.8075437432 40.7175697107),hospital
Seaview Hospital,Richmond,9/7/05,04NR05341,-74.13232647,40.59149314,POINT (-74.1323264712 40.5914931361),hospital
St. Luke's Hospital,New York,5/20/19,19NR00003,-73.96125328,40.80501017,POINT (-73.961253283 40.8050101709),hospital
City Hospital,New York,3/16/72,90NR00628,-73.95828967,40.7529402,POINT (-73.9582896717 40.7529402018),hospital
Smallpox Hospital,New York,3/16/72,90NR00633,-73.95958272,40.75160249,POINT (-73.9595827175 40.751602492),hospital
Gouverneur Hospital,New York,10/29/82,90NR00891,-73.9835845,40.71106097,POINT (-73.9835844964 40.7110609741),hospital
Society for the Lying-In Hospital,New York,8/30/83,90NR00818,-73.9836711,40.73475222,POINT (-73.9836710994 40.7347522214),hospital
Ottendorfer Public Library and Stuyvesant Polyclinic Hospital,New York,7/22/79,90NR00789,-73.98779974,40.72904301,POINT (-73.9877997447 40.7290430069),hospital
Eighth Regiment Armory (Kingsbridge Armory),Bronx,12/21/82,90NR00071,-73.89825145,40.86847843,POINT (-73.8982514516 40.8684784272),armory
Fort Washington Avenue (22nd Corps of Engineers) Armory,New York,3/2/95,94NR00545,-73.94129367,40.8421349,POINT (-73.9412936741 40.8421349045),armory
Seventh Regiment Armory,New York,4/14/75,90NR00657,-73.96551931,40.76725038,POINT (-73.9655193078 40.767250383),armory
Flushing Armory,Queens,3/23/95,95NR00781,-73.82893475,40.76314902,POINT (-73.8289347529 40.763149019),armory
Twenty-third Regiment Armory,Kings,5/6/80,90NR01277,-73.95382362,40.67843735,POINT (-73.9538236201 40.6784373483),armory
69TH Regiment Armory,New York,1/28/94,93NR00513,-73.98421774,40.7413652,POINT (-73.9842177449 40.7413652016),armory
Madison Avenue Facade of the Squadron A Armory,New York,3/24/72,90NR00637,-73.9547062,40.78616929,POINT (-73.954706204 40.7861692943),armory
Eighth Avenue (14th Regiment) Armory,Kings,4/14/94,94NR00539,-73.98292644,40.66290879,POINT (-73.9829264373 40.6629087874),armory
369th Regiment Armory,New York,1/28/94,93NR00511,-73.93516357,40.81789107,POINT (-73.9351635724 40.8178910721),armory
First Battery Armory,New York,2/20/13,12NR06396,-73.98080693,40.77303636,POINT (-73.9808069307 40.7730363584),armory
Queensboro Bridge,New York,12/20/78,90NR00948,-73.95072109,40.75519957,POINT (-73.9507210879 40.7551995665),bridge
Manhattan Bridge,Kings,9/1/83,90NR01298,-73.98995677,40.70601994,POINT (-73.9899567695 40.7060199368),bridge
69th Street Transfer Bridge of the New York Central Railroad,New York,6/26/03,03NR05051,-73.98970669,40.77920273,POINT (-73.9897066884 40.7792027257),bridge
Port Morris Ferry Bridges,Bronx,2/5/14,13NR06490,-73.90834473,40.79942573,POINT (-73.9083447343 40.7994257308),bridge
High Bridge Aqueduct and Water Tower,Bronx,12/4/72,90NR00923,-73.93259328,40.84245936,POINT (-73.9325932795 40.8424593569),bridge
Brooklyn Bridge,Kings,10/15/66,90NR01324,-73.99682684,40.70608059,POINT (-73.9968268405 40.7060805925),bridge
"Keeper's House, Williamsbridge Reservoir",Bronx,9/24/99,99NR01459,-73.87569842,40.87901115,POINT (-73.8756984154 40.8790111511),bridge
"Riverdale, Spuyten Duyvil, Kingsbridge Memorial Bell Tower",Bronx,1/3/12,11NR06255,-73.90838356,40.88926543,POINT (-73.9083835586 40.8892654313),bridge
Brooklyn Bridge - City Hall Subway Station (IRT),New York,7/6/05,04NR05363,-74.00420882,40.71295478,POINT (-74.0042088191 40.7129547833),bridge
Washington Bridge,Bronx,9/22/83,90NR00059,-73.92752006,40.84659853,POINT (-73.9275200637 40.8465985286),bridge
Old Town of Flushing Burial Ground,Queens,2/2/18,16NR00107,-73.80230575,40.75462525,POINT (-73.8023057486 40.754625252),burial ground
African Burial Ground,New York,4/19/93,93NR00474,-74.00478773,40.71419481,POINT (-74.0047877348 40.7141948091),burial ground
Eleventh Street Methodist-Episcopal Chapel,New York,12/30/11,11NR06261,-73.9798041,40.72786803,POINT (-73.9798041036 40.7278680305),chapel
Trinity Chapel Complex,New York,12/16/82,90NR00944,-73.98982956,40.74373757,POINT (-73.98982956 40.7437375746),chapel
Chapel Of The Good Shepherd,New York,3/16/72,90NR00627,-73.95023339,40.76185884,POINT (-73.9502333925 40.7618588359),chapel
Trinity Chapel,Queens,1/11/02,01NR01799,-73.75092307,40.6038766,POINT (-73.7509230665 40.6038766033),chapel
St. Augustine's Chapel,New York,5/6/80,90NR00700,-73.98312495,40.71366206,POINT (-73.9831249461 40.713662061),chapel
St. Paul's Chapel,New York,10/15/66,90NR00878,-74.0095785,40.7114782,POINT (-74.0095784978 40.7114781987),chapel
Lisanti Chapel,Bronx,1/11/02,01NR01803,-73.86289514,40.88005266,POINT (-73.8628951445 40.8800526553),chapel
The Church of the Heavenly Rest and the Chapel of the Beloved Disciple,New York,3/3/21,20NR00079,-73.95813765,40.78367643,POINT (-73.9581376454 40.783676433),chapel
German Evangelical Lutheran Church of St. Mark,New York,4/15/04,03NR05087,-73.98719321,40.72707341,POINT (-73.9871932139 40.7270734136),church
Saint James Church,Queens,11/12/99,99NR01470,-73.87782521,40.73835016,POINT (-73.8778252137 40.7383501625),church
West End Presbyterian Church & Parish House,New York,12/30/11,11NR06262,-73.96575381,40.79982963,POINT (-73.9657538067 40.7998296257),church
Holy Trinity (Protestant Episcopal) Church,Kings,12/23/87,90NR01349,-73.99266111,40.69458066,POINT (-73.9926611073 40.6945806614),church
Congregational Church of the Evangel,Kings,12/11/09,09NR06032,-73.95684551,40.65720916,POINT (-73.9568455149 40.6572091555),church
St. Bartholomew's Protestant Episcopal Church and Rectory,Kings,4/23/80,90NR01274,-73.95205716,40.67814885,POINT (-73.9520571567 40.6781488466),church
Hanson Place Seventh Day Adventist Church,Kings,4/23/80,90NR01273,-73.97393118,40.68525678,POINT (-73.9739311788 40.685256775),church
Immanuel Union Church,Richmond,7/27/18,18NR00015,-74.13120035,40.62017891,POINT (-74.1312003495 40.6201789095),church
St. George's Episcopal Church,New York,12/8/76,90NR00931,-73.98500474,40.73436148,POINT (-73.9850047365 40.7343614753),church
Grace Church and Dependencies,New York,6/28/74,90NR00768,-73.99080374,40.73196959,POINT (-73.9908037416 40.7319695887),church
Church of the Holy Innocents,Kings,6/16/05,04NR05415,-73.96267224,40.64449054,POINT (-73.9626722385 40.6444905361),church
St. Monica's Church,Queens,4/9/80,90NR01568,-73.79830735,40.70195962,POINT (-73.7983073508 40.7019596158),church
First Presbyterian Church of Newtown,Queens,9/9/13,13NR06450,-73.87708618,40.73558167,POINT (-73.8770861841 40.7355816696),church
St. Philips Protestant Episcopal Church,New York,9/25/08,97NR01231,-73.94527783,40.81466251,POINT (-73.9452778336 40.8146625079),church
St. StephenΓÇÖs Mission Church Complex,Bronx,7/29/21,21NR00029,-73.86354454,40.9002842,POINT (-73.8635445447 40.9002841962),church
Christ Evangelical English Lutheran Church,Kings,8/30/07,07NR05736,-73.92865992,40.69226487,POINT (-73.9286599234 40.6922648721),church
Fourth Avenue Methodist Episcopal Church,Kings,8/8/19,19NR00028,-74.01096463,40.6485159,POINT (-74.0109646333 40.6485159015),church
Church of St. Ignatius Loyola Complex,New York,7/24/80,90NR00794,-73.95890303,40.77917091,POINT (-73.9589030324 40.7791709125),church
Church of Notre Dame and Rectory,New York,5/6/80,90NR00694,-73.96045127,40.80511199,POINT (-73.9604512689 40.8051119934),church
St. John's Church Complex,Richmond,,94NR00547,-74.06325563,40.61149345,POINT (-74.0632556334 40.6114934539),church
Church of St. Paul the Apostle,New York,12/5/91,91NR00098,-73.98519838,40.76981159,POINT (-73.9851983845 40.7698115923),church
St. Andrew's Episcopal Church,New York,3/18/80,90NR00635,-73.94077224,40.80773282,POINT (-73.9407722425 40.8077328186),church
Church of the Holy Communion and Buildings,New York,4/17/80,90NR00664,-73.99363032,40.74103924,POINT (-73.993630323 40.741039238),church
St. Thomas Church and Parish House,New York,4/9/80,90NR00655,-73.976256,40.76085063,POINT (-73.9762560035 40.7608506315),church
Flatbush Dutch Reformed Church Complex,Kings,9/8/83,90NR01302,-73.95933782,40.6497844,POINT (-73.9593378224 40.6497843964),church
Grace Episcopal Church,Bronx,9/13/06,06NR05589,-73.78383111,40.84097892,POINT (-73.7838311114 40.8409789166),church
St. Luke's Evangelical Lutheran Church,New York,6/1/07,06NR05682,-73.98871392,40.7598784,POINT (-73.9887139216 40.7598784019),church
Calvary Methodist Episcopal Church,New York,5/16/16,15NR00135,-73.94684991,40.81193202,POINT (-73.9468499051 40.8119320204),church
Christ Church New Brighton,Richmond,5/27/04,03NR05201,-74.09283736,40.64345983,POINT (-74.0928373605 40.6434598275),church
Holyrood Protestant Episcopal Church,New York,10/29/20,20NR00037,-73.93840714,40.84943607,POINT (-73.9384071428 40.8494360652),church
New Utrecht Reformed Church and Buildings,Kings,4/9/80,90NR01266,-74.00049523,40.60830871,POINT (-74.000495234 40.6083087121),church
Fort Washington Presbyterian Church,New York,1/7/10,09NR06027,-73.93786749,40.84537914,POINT (-73.9378674933 40.8453791441),church
Immanuel Congregational Church,Kings,6/7/06,06NR05560,-73.92474393,40.68268619,POINT (-73.9247439308 40.6826861854),church
St. Mary's Episcopal Church,Kings,7/21/83,90NR01292,-73.96130103,40.69273094,POINT (-73.9613010285 40.6927309437),church
St. Matthew's Episcopal Church,Queens,7/25/01,01NR01759,-73.84922411,40.6961578,POINT (-73.8492241073 40.6961578033),church
South Congregational Church,Kings,11/4/82,90NR01333,-73.99653519,40.68205961,POINT (-73.9965351898 40.6820596113),church
Elmendorf Reformed Church,New York,4/27/10,09NR06085,-73.93823899,40.80167357,POINT (-73.9382389934 40.8016735694),church
"Sage, Russell, Memorial Church",Queens,9/22/86,90NR01591,-73.7470899,40.60966879,POINT (-73.747089895 40.6096687939),church
St. PeterΓÇÖs Protestant Episcopal Church,Kings,11/8/21,21NR00037,-73.98466873,40.68792671,POINT (-73.9846687252 40.6879267106),church
John Street Methodist Church,New York,6/4/73,90NR00754,-74.00814751,40.70910478,POINT (-74.0081475112 40.7091047776),church
Reformed Church of Melrose,Bronx,5/15/17,17NR00002,-73.91362452,40.82047034,POINT (-73.9136245168 40.8204703409),church
Edgehill Church of Spuyten Duyvil,Bronx,10/29/82,90NR00066,-73.92044038,40.8803059,POINT (-73.9204403799 40.8803058957),church
Church of the Holy Apostles,New York,4/26/72,90NR00686,-73.99881948,40.74927934,POINT (-73.9988194816 40.7492793372),church
Church of St. Andrew (Episcopal),Richmond,10/6/00,94NR00546,-74.14740152,40.57278432,POINT (-74.1474015222 40.5727843167),church
Our Lady of Lourdes Roman Catholic Church,New York,,94NR00529,-73.94818766,40.82322462,POINT (-73.9481876609 40.8232246161),church
Grace Episcopal Church Complex,Queens,9/8/83,90NR01584,-73.80135746,40.70404575,POINT (-73.8013574636 40.7040457451),church
Church of the Ascension (Protestant Episcopal),New York,12/23/87,90NR02844,-73.99571888,40.73377403,POINT (-73.9957188764 40.7337740278),church
Trinity Church and Graveyard,New York,12/8/76,90NR00933,-74.01205616,40.70815597,POINT (-74.0120561574 40.7081559711),church
Sea and Land Church,New York,4/9/80,90NR00654,-73.99480476,40.71322168,POINT (-73.9948047633 40.7132216795),church
Calvary Presbyterian Church,Richmond,11/21/02,02NR04980,-74.11268493,40.63506268,POINT (-74.1126849324 40.6350626781),church
St. Cecilia's Church and Convent,New York,2/2/84,90NR00617,-73.94727055,40.79236048,POINT (-73.9472705502 40.7923604779),church
United Methodist Church of St. Paul and St. Andrew Complex,New York,,91NR00273,-73.97729225,40.78898469,POINT (-73.9772922524 40.788984694),church
The Church-in-the-Gardens,Queens,12/11/09,09NR06050,-73.84129658,40.71644378,POINT (-73.8412965809 40.7164437843),church
West Side Unitarian Church ΓÇô Congregation Ramath Orah,New York,9/17/15,15NR00056,-73.96610669,40.80365487,POINT (-73.9661066865 40.8036548743),church
"Fourth Church of Christ, Scientist",New York,8/30/11,11NR06231,-73.9376832,40.85365031,POINT (-73.9376831968 40.8536503059),church
St. Jean Baptiste Church and Rectory,New York,4/23/80,90NR00681,-73.95988475,40.77258417,POINT (-73.9598847527 40.77258417),church
Rugby Congregational Church,Kings,8/17/20,19NR00068,-73.93095637,40.65031704,POINT (-73.930956373 40.6503170418),church
St. Anselm's Roman Catholic Church Complex,Bronx,2/5/14,13NR06497,-73.90564535,40.81619954,POINT (-73.9056453526 40.8161995355),church
Riverside Church,New York,12/12/12,12NR06373,-73.96308565,40.81176388,POINT (-73.9630856459 40.8117638787),church
Trinity Lutheran Church,Queens,5/29/08,08NR05837,-73.9192716,40.76178268,POINT (-73.9192716007 40.7617826754),church
Trinity Evangelical Lutheran Church of Manhattan,New York,9/16/09,09NR06002,-73.96810552,40.7962129,POINT (-73.9681055233 40.7962129003),church
Church of the Transfiguration and Rectory,New York,6/4/73,90NR00753,-73.98594544,40.74517373,POINT (-73.9859454387 40.7451737323),church
First Reformed Church,Queens,4/16/80,90NR01569,-73.80172105,40.7024711,POINT (-73.8017210495 40.7024710994),church
St. Luke's Protestant Episcopal Church,Kings,9/16/82,90NR01311,-73.96720568,40.68268923,POINT (-73.96720568 40.6826892338),church
New York Presbyterian Church,New York,6/3/82,90NR00752,-73.94639942,40.81092329,POINT (-73.9463994197 40.8109232937),church
Zion-St. Mark's Evangelical Lutheran Church,New York,3/23/95,93NR00502,-73.95104756,40.77612512,POINT (-73.9510475554 40.7761251214),church
St. Matthias RC Church Complex,Queens,9/4/12,12NR06354,-73.90253049,40.70215718,POINT (-73.9025304947 40.7021571791),church
Bay Ridge United Methodist Church,Kings,9/9/99,99NR01471,-74.02456731,40.63362797,POINT (-74.0245673123 40.6336279738),church
St. Ann's Church Complex,Bronx,4/16/80,90NR00036,-73.91734937,40.80844986,POINT (-73.917349374 40.8084498649),church
St. Paul's Memorial Church and Rectory,Richmond,11/21/80,90NR01043,-74.07888455,40.63206956,POINT (-74.0788845532 40.6320695635),church
First African Methodist Episcopal Church: Bethel,New York,11/9/18,17NR00116,-73.94089671,40.81134225,POINT (-73.9408967086 40.8113422526),church
Church of the Immaculate Conception and Clergy Houses,New York,3/28/80,90NR00641,-73.9821527,40.73069862,POINT (-73.982152695 40.7306986233),church
Bay Ridge Reformed Church,Kings,8/17/20,19NR00103,-74.03154285,40.62858734,POINT (-74.03154285 40.6285873399),church
Marble Collegiate Reformed Church,New York,4/9/80,90NR00653,-73.9870947,40.74566498,POINT (-73.9870947038 40.7456649831),church
St. Peter's Roman Catholic Church,New York,4/23/80,90NR00682,-74.00955548,40.71237485,POINT (-74.0095554803 40.7123748548),church
New Utrecht Reformed Church Complex (Boundary Increase),Kings,3/5/01,98NR01291,-74.00598897,40.61078099,POINT (-74.0059889674 40.6107809907),church
First Reformed Church of College Point,Queens,11/16/18,18NR00058,-73.84900193,40.78623109,POINT (-73.8490019296 40.7862310931),church
Andrews United Methodist Church,Kings,1/22/92,91NR00174,-73.87695223,40.68533125,POINT (-73.8769522273 40.6853312452),church
Church of the Resurrection,Queens,3/7/03,02NR05012,-73.83248746,40.70235565,POINT (-73.8324874551 40.7023556524),church
Greenwood Baptist Church,Kings,2/16/16,15NR00069,-73.98016076,40.66906953,POINT (-73.9801607581 40.6690695286),church
Tremont Baptist Church,Bronx,10/16/09,08NR05908,-73.90232475,40.84822497,POINT (-73.9023247472 40.8482249708),church
Christ Church Complex,Bronx,9/8/83,90NR00052,-73.90635673,40.89904647,POINT (-73.9063567321 40.8990464682),church
Church Missions House,New York,6/3/82,90NR00746,-73.98671522,40.73925594,POINT (-73.9867152195 40.7392559407),church
Lewis Avenue Congregational Church,Kings,1/24/20,18NR00049,-73.93538194,40.68614259,POINT (-73.9353819439 40.6861425943),church
St. Alban's Episcopal Church,Richmond,10/29/82,90NR01040,-74.1605174,40.54388579,POINT (-74.160517397 40.5438857886),church
South Bushwick Reformed Protestant Dutch Church Complex,Kings,11/4/82,90NR01332,-73.92604397,40.69435683,POINT (-73.9260439736 40.6943568294),church
St. James' Episcopal Church and Parish House,Bronx,9/30/82,90NR00063,-73.89953696,40.864045,POINT (-73.8995369587 40.8640449959),church
Church of the Incarnation and Parish House,New York,7/8/82,90NR00775,-73.98199301,40.74848185,POINT (-73.9819930132 40.7484818523),church
North Presbyterian Church,New York,2/5/14,13NR06494,-73.94438984,40.83247306,POINT (-73.9443898381 40.8324730578),church
St. George's Church,Queens,3/7/08,95NR00810,-73.83119881,40.76035583,POINT (-73.8311988065 40.7603558261),church
St. Michael's Church Complex,New York,11/15/96,96NR01080,-73.96928585,40.79646197,POINT (-73.9692858485 40.7964619722),church
St. Bartholomew's Church and Community House,New York,4/16/80,90NR00662,-73.97315203,40.75725789,POINT (-73.9731520331 40.7572578877),church
"Judson Memorial Church, Campanile, and Judson Hall",New York,10/16/74,90NR00882,-73.99841778,40.73021837,POINT (-73.9984177811 40.7302183729),church
German Evangelical Lutheran St. John's Church,Kings,1/31/19,18NR00078,-73.94274984,40.7112261,POINT (-73.9427498441 40.7112260955),church
Bushwick Avenue Central Methodist Episcopal Church,Kings,3/27/17,15NR00134,-73.91787234,40.68975263,POINT (-73.9178723363 40.6897526343),church
Plymouth Church of the Pilgrims,Kings,10/15/66,90NR01326,-73.99349593,40.69942874,POINT (-73.9934959323 40.6994287443),church
Cuyler Presbyterian Church,Kings,3/23/01,00NR01718,-73.98651609,40.68654669,POINT (-73.9865160872 40.6865466892),church
Holy Cross African Orthodox Church Pro-Cathedral,New York,11/9/17,17NR00066,-73.94475316,40.81055348,POINT (-73.9447531582 40.8105534776),church
Church of St. Mary the Virgin Complex,New York,4/16/90,91NR00067,-73.98360669,40.75835847,POINT (-73.9836066857 40.7583584662),church
Flatlands Dutch Reformed Church,Kings,8/30/79,90NR01297,-73.93651474,40.62384257,POINT (-73.9365147401 40.6238425722),church
Riverdale Presbyterian Church Complex,Bronx,10/14/82,90NR00064,-73.90894653,40.89587001,POINT (-73.9089465256 40.8958700101),church
St. Ignatius of Antioch Episcopal Church,New York,11/30/99,99NR01495,-73.97718598,40.78924599,POINT (-73.9771859808 40.7892459925),church
"Holy Trinity Church, St. Christopher House and Parsonage",New York,5/30/80,90NR00732,-73.94972702,40.77847937,POINT (-73.9497270167 40.7784793712),church
First Hungarian Reformed Church,New York,8/31/00,00NR01655,-73.95852867,40.76613497,POINT (-73.9585286685 40.7661349701),church
Church of St. Vincent Ferrer and Priory,New York,6/14/84,90NR00756,-73.96475533,40.7661102,POINT (-73.9647553265 40.7661102006),church
Emmanuel Baptist Church,Kings,12/16/77,90NR01348,-73.96526379,40.68856802,POINT (-73.9652637901 40.6885680174),church
St. George's Protestant Episcopal Church,Kings,9/8/83,90NR01304,-73.94778877,40.68631363,POINT (-73.9477887739 40.6863136295),church
St. Stephen's United Methodist Church,Bronx,2/8/12,11NR06263,-73.90903863,40.87691915,POINT (-73.909038629 40.8769191454),church
Brighton Heights Reformed Church,Richmond,6/3/82,90NR01025,-74.07836751,40.64173025,POINT (-74.0783675108 40.6417302549),church
Old First Reformed Church,Kings,4/1/98,97NR01247,-73.97663219,40.67356647,POINT (-73.9766321892 40.6735664654),church
Reformed Church of Newtown Complex,Queens,4/23/80,90NR01572,-73.87738423,40.73928559,POINT (-73.8773842316 40.7392855874),church
Reformed Church on Staten Island,Richmond,1/20/05,04NR05269,-74.13271651,40.63969157,POINT (-74.1327165117 40.6396915729),church
St. Paul's Protestant Episcopal Church,Kings,12/21/89,90NR03153,-73.99798836,40.68169057,POINT (-73.9979883648 40.6816905719),church
Saint Luke's Episcopal Church,Queens,11/10/10,10NR06147,-73.84463104,40.71401348,POINT (-73.8446310392 40.714013476),church
Church of the Transfiguration,New York,4/16/80,90NR00658,-73.9990829,40.71471494,POINT (-73.9990829018 40.7147149379),church
New England Congregational Church and Rectory,Kings,9/15/83,90NR01308,-73.96188112,40.70870488,POINT (-73.9618811201 40.7087048848),church
Woodrow Methodist Church,Richmond,10/29/82,90NR01041,-74.2010676,40.54333074,POINT (-74.2010676032 40.5433307429),church
St. James Church,New York,7/24/72,90NR00795,-73.99851466,40.71223636,POINT (-73.9985146644 40.7122363588),church
United States Post Office-Church Street Station,New York,5/11/89,90NR00712,-74.0106422,40.71274316,POINT (-74.0106422028 40.7127431605),church
University Club,New York,4/16/80,90NR00663,-73.9756744,40.7614815,POINT (-73.9756743982 40.7614814953),club
Racquet Court Club Building,New York,,91NR00264,-73.99095261,40.74482272,POINT (-73.9909526131 40.7448227234),club
Knickerbocker Field Club,Kings,10/29/82,90NR01328,-73.96349727,40.64772862,POINT (-73.9634972701 40.6477286224),club
Level Club,New York,4/9/84,90NR00652,-73.98295262,40.78031349,POINT (-73.9829526241 40.7803134856),club
Old Colony Club,New York,4/23/80,90NR00677,-73.98490043,40.74558234,POINT (-73.984900434 40.7455823366),club
Lamb's Club,New York,6/3/82,90NR00750,-73.98458693,40.75650269,POINT (-73.9845869255 40.7565026901),club
Old Grolier Club,New York,4/23/80,90NR00678,-73.98329065,40.74647157,POINT (-73.9832906503 40.7464715737),club
Engineering Societies' Building and Engineers' Club,New York,8/30/07,07NR05737,-73.98370014,40.75256382,POINT (-73.9837001392 40.7525638212),club
Harvard Club of New York City,New York,3/28/80,90NR00644,-73.98116228,40.75570736,POINT (-73.9811622773 40.7557073605),club
Fort Totten Officers' Club,Queens,3/17/86,90NR01567,-73.77769188,40.79217497,POINT (-73.7776918792 40.7921749733),club
"Clarke, Thomas B., Residence (Collectors Club Building)",New York,,94NR00527,-73.98207948,40.74803201,POINT (-73.9820794805 40.7480320094),club
New York Yacht Club,New York,10/29/82,90NR00897,-73.98157609,40.75572652,POINT (-73.9815760907 40.7557265172),club
Salmagundi Club,New York,7/25/74,90NR00797,-73.99445315,40.73426135,POINT (-73.9944531483 40.7342613529),club
Lincoln Club,Kings,1/27/83,90NR01263,-73.95935964,40.6832197,POINT (-73.9593596371 40.6832196962),club
The Women's National Republican Club,New York,2/27/13,12NR06397,-73.97732093,40.75965746,POINT (-73.977320932 40.7596574622),club
Racquet and Tennis Club Building,New York,7/13/83,90NR00779,-73.97321712,40.75890856,POINT (-73.9732171206 40.758908556),club
Civic Club,New York,9/16/82,90NR00848,-73.97614795,40.74520926,POINT (-73.9761479496 40.74520926),club
Poe Cottage,Bronx,8/19/80,90NR00047,-73.8946132,40.86481128,POINT (-73.8946132037 40.8648112798),cottage
Fort Tompkins Quadrangle,Richmond,7/30/74,90NR01029,-74.05660684,40.60503557,POINT (-74.0566068426 40.6050355674),district
"Casemate Fort, Whiting Quadrangle",Kings,8/7/74,90NR01295,-74.03253277,40.60867621,POINT (-74.0325327737 40.6086762111),district
Fort Tryon Park And The Cloisters,New York,12/19/78,90NR00947,-73.93220078,40.86237803,POINT (-73.9322007849 40.8623780264),district
"New York Public Library, Fort Washington Branch",New York,8/27/20,20NR00052,-73.93384522,40.84790011,POINT (-73.9338452202 40.8479001117),district
Fort Wadsworth,Richmond,,98NR01405,-74.05692758,40.6025256,POINT (-74.0569275762 40.6025256023),district
Fort Schuyler,Bronx,6/29/76,90NR00044,-73.79261125,40.80565577,POINT (-73.7926112468 40.805655767),district
Fort Jay,New York,3/27/74,90NR00640,-74.01599718,40.69138658,POINT (-74.0159971842 40.691386579),district
City & Suburban Homes Company's York Avenue Estate,New York,9/15/94,90NR03286,-73.94954816,40.77035762,POINT (-73.9495481594 40.7703576204),estate
City & Suburban Homes Company's First Avenue Estate Historic Dist,New York,8/1/86,90NR00803,-73.95834375,40.7625893,POINT (-73.9583437539 40.7625892998),estate
Radio City Music Hall,New York,5/8/78,90NR00704,-73.97928331,40.75983455,POINT (-73.9792833062 40.7598345536),hall
New Brighton Village Hall,Richmond,12/15/78,90NR01045,-74.09590868,40.6431091,POINT (-74.095908678 40.6431090976),hall
Odd Fellows Hall,New York,9/22/83,90NR00855,-73.99843217,40.7194854,POINT (-73.998432173 40.7194853988),hall
"Milbank, Brinckerhoff, and Fiske Halls",New York,11/15/03,03NR05120,-73.96286612,40.81042658,POINT (-73.9628661237 40.810426578),hall
Edgewater Village Hall and Tappen Park,Richmond,5/19/80,90NR01024,-74.07673844,40.62683556,POINT (-74.0767384403 40.6268355572),hall
Brooklyn Borough Hall,Kings,1/10/80,90NR01259,-73.99019947,40.69273854,POINT (-73.9901994719 40.6927385382),hall
Prospect Hall,Kings,4/15/99,98NR01397,-73.98937984,40.66390299,POINT (-73.9893798364 40.6639029948),hall
Brooks and Hewitt Halls,New York,11/15/03,03NR05121,-73.96440663,40.8086219,POINT (-73.9644066338 40.8086219022),hall
"Founder's Hall, The Rockefeller University",New York,5/30/74,90NR00840,-73.95520226,40.76248885,POINT (-73.9552022627 40.7624888504),hall
Firemen's Hall,Queens,8/31/00,00NR01654,-73.84505989,40.78579873,POINT (-73.845059894 40.7857987295),hall
Philosophy Hall,New York,7/31/03,03NR05188,-73.96094445,40.80744895,POINT (-73.9609444467 40.8074489549),hall
Town Hall,New York,4/23/80,90NR00683,-73.98438194,40.75609831,POINT (-73.9843819426 40.7560983119),hall
Flushing Town Hall,Queens,3/16/72,90NR01566,-73.83001381,40.7639075,POINT (-73.8300138146 40.7639075002),hall
BOHEMIAN HALL AND PARK,Queens,3/23/01,00NR01724,-73.91579925,40.77296047,POINT (-73.915799251 40.7729604734),hall
Flatbush Town Hall,Kings,7/24/72,90NR01294,-73.95693179,40.64895663,POINT (-73.9569317873 40.6489566316),hall
