Resource Name,County,National Register Date,National Register Number,Longitude,Latitude,Georeference
Hertlein and Schlatter Silk Trimmings Factory,Bronx,02/05/2001,00NR01719,-73.9159434037,40.8142394996,POINT (-73.9159434037 40.8142394996)
Jewett Refrigerator Company Factory,Erie,11/09/2018,18NR00064,-78.8899708696,42.9429272037,POINT (-78.8899708696 42.9429272037)
"Searle, Gardner & Company Cuff and Collar Factory",Rensselaer,01/15/2014,13NR06482,-73.6837687259,42.7463474635,POINT (-73.6837687259 42.7463474635)
Keith & Branch Ford Factory & Showroom,Essex,05/28/2013,13NR06436,-73.7752568609,44.3362899028,POINT (-73.7752568609 44.3362899028)
Pilgrim Furniture Company Factory,Ulster,05/04/2018,18NR00003,-74.0073524815,41.9256897813,POINT (-74.0073524815 41.9256897813)
FN Burt Company Factory,Erie,03/06/2013,12NR06403,-78.8571327577,42.8776806843,POINT (-78.8571327577 42.8776806843)
Pierce Arrow Factory Complex,Erie,10/01/1974,90NR01237,-78.8738284494,42.9429521535,POINT (-78.8738284494 42.9429521535)
George J. Michelsen Furniture Factory,Monroe,06/06/2012,11NR06295,-77.6196627296,43.1805482043,POINT (-77.6196627296 43.1805482043)
"Herschell, Allan, Carousel Factory",Niagara,04/18/1985,90NR01971,-78.8729820477,43.0299457259,POINT (-78.8729820477 43.0299457259)
Morganville Pottery Factory Site,Genesee,02/15/1974,90NR00523,-78.0747008629,43.0053564362,POINT (-78.0747008629 43.0053564362)
Welch Factory Building No. 1,Chautauqua,09/26/1983,90NR00128,-79.5814825326,42.3266270311,POINT (-79.5814825326 42.3266270311)
Yale-Cady Octagon House & Yale Lock Factory Site,Herkimer,09/29/2007,07NR05758,-75.0182082077,43.1914909932,POINT (-75.0182082077 43.1914909932)
Oval Wood Dish Factory,Franklin,03/02/2021,20NR00096,-74.4681328968,44.2362677962,POINT (-74.4681328968 44.2362677962)
Sohmer Piano Factory,Queens,02/14/2014,13NR06495,-73.9351041345,40.7690352578,POINT (-73.9351041345 40.7690352578)
MerrellΓÇôSoule None Such Mince Meat Factory,Onondaga,03/30/2020,19NR00033,-76.1570372132,43.0577115037,POINT (-76.1570372132 43.0577115037)
Sibley & Holmwood Candy Factory and the Witkop & Holmes Headquarters,Erie,07/11/2014,13NR06496,-78.8701129859,42.880529977,POINT (-78.8701129859 42.880529977)
Spear & Company Factory,Queens,11/09/2017,17NR00060,-73.8430437799,40.6887231931,POINT (-73.8430437799 40.6887231931)
Rockwood Chocolate Factory Historic District,Kings,10/06/1983,90NR01322,-73.9680712706,40.6966941594,POINT (-73.9680712706 40.6966941594)
Parkside Candy Shoppe and Factory,Erie,11/16/2015,15NR00083,-78.8260363362,42.9517661534,POINT (-78.8260363362 42.9517661534)
C. Rieger's Sons Factory,Bronx,05/27/2004,03NR05200,-73.9163830275,40.8143859566,POINT (-73.9163830275 40.8143859566)
Continental Baking Company Factory (aka Wonder Bread Factory,Erie,11/08/2021,21NR00013,-78.8280742695,42.9087333786,POINT (-78.8280742695 42.9087333786)
J. Hungerford Smith Co. Factory,Monroe,11/08/2021,21NR00059,-77.5827253265,43.1612870625,POINT (-77.5827253265 43.1612870625)
National Curtain Lace Factory,Ulster,03/20/2013,12NR06409,-73.9985786289,41.9346440103,POINT (-73.9985786289 41.9346440103)
Triangle Shirtwaist Factory (Brown Building),New York,07/17/1991,92NR00303,-73.9953701261,40.7300879393,POINT (-73.9953701261 40.7300879393)
"F.N. Burt Factory ""C""",Erie,04/17/2017,16NR00088,-78.898281955,42.9249861085,POINT (-78.898281955 42.9249861085)
Fedders Manufacturing Company Factory,Erie,,21NR00082,-78.8964139758,42.9304493118,POINT (-78.8964139758 42.9304493118)
Allan Herschell Carousel Factory (Boundary Increase),Niagara,,11NR06219,-78.8728262188,43.0302578509,POINT (-78.8728262188 43.0302578509)
Brandreth Pill Factory,Westchester,01/10/1980,90NR02504,-73.8694908376,41.1652943071,POINT (-73.8694908376 41.1652943071)
Dolge Company Factory Complex,Herkimer,09/17/1974,90NR00574,-74.7686460645,43.1015653714,POINT (-74.7686460645 43.1015653714)
Niagara Machine & Tool Works Factory,Erie,03/26/2018,17NR00035,-78.8350507576,42.918127106,POINT (-78.8350507576 42.918127106)
Linde Air Products Factory,Erie,09/11/2017,16NR00129,-78.8854060059,42.9428651759,POINT (-78.8854060059 42.9428651759)
Barcalo Manufacturing Company Factory,Erie,08/17/2020,19NR00017,-78.8654090136,42.8675199488,POINT (-78.8654090136 42.8675199488)
Ansco Company Charles Street Factory Buildings,Broome,08/22/2012,12NR06351,-75.9300341366,42.1069499216,POINT (-75.9300341366 42.1069499216)
"Wilbur, Campbell Stephens Co. Factory (Mooradians)",Rensselaer,02/02/2016,15NR00096,-73.6857561479,42.7423012999,POINT (-73.6857561479 42.7423012999)
"PAD Factory, The",Essex,11/15/1988,90NR00488,-73.4270016549,43.8479283658,POINT (-73.4270016549 43.8479283658)
Harrison Radiator Corporation Factory,Niagara,04/22/2021,19NR00091,-78.6876697798,43.1692212672,POINT (-78.6876697798 43.1692212672)
Fuller Shirt Company Factory,Ulster,07/27/2018,18NR00004,-74.00176045,41.9269511323,POINT (-74.00176045 41.9269511323)
"Van Zandt, Jacobs & Co. Collar and Cuff Factory",Rensselaer,02/14/2014,13NR06517,-73.6856132924,42.7428402786,POINT (-73.6856132924 42.7428402786)
Lion Factory,Rensselaer,,21NR00023,-73.6737673076,42.7810581177,POINT (-73.6737673076 42.7810581177)
Monarch Knitting Mill Factory,Erie,03/07/2019,17NR00093,-78.8198766242,42.9091303622,POINT (-78.8198766242 42.9091303622)
General Cigar Company--Ansco Camera Factory Building,Broome,08/22/2012,12NR06350,-75.9421101018,42.1109727007,POINT (-75.9421101018 42.1109727007)
M. Wile and Company Factory Building,Erie,11/22/2000,00NR01624,-78.8684535299,42.8944996275,POINT (-78.8684535299 42.8944996275)
Poughkeepsie Underwear Factory,Dutchess,11/26/1982,90NR00419,-73.91798442,41.7014833445,POINT (-73.91798442 41.7014833445)
